{
    "product_id": "SW_MIO_SHA_2E",
    "definition": "Model of polar daily geomagnetic variation caused by ionospheric currents (AMPS model)",
    "applicable_missions": [
        "Swarm"
    ],
    "applicable_spacecraft": [
        "Swarm-A",
        "Swarm-B",
        "Swarm-C"
    ],
    "thematic_areas": [
        "Ionosphere/Magnetosphere"
    ],
    "description": " Model of polar daily geomagnetic variation caused by ionospheric currents (AMPS model)",
    "link_files_http": "https://swarm-diss.eo.esa.int/#swarm/Level2longterm/MIO",
    "link_files_ftp": "ftp://swarm-diss.eo.esa.int/Level2longterm/MIO",
    "link_vires_gui": "https://vires.services?ws=data%3Aapplication/json%2Bgzip%3Bbase64%2CH4sIAMta5mMC/51Va0/bMBT9K1W%2Bro38iF98K4Vuk4AhygYUVVFoTPGUJpWTdiDU/75r00caBoNKVhsf33POzbVz/RyU2i7MWP/StjRFHhy0AhpiHKKg3QoqM9UDnelx9bJ0GxCEeQdhGJcIHfgRIoSGLrq2RugBUzBCpdQwGK2kjoppYjY6rINJh0IseUuHXKKdNaezMPpPPaVgkhV32tFmtkjn46rsFfm9mcxtsop4DgZX8Y/z44v4tPu1G59cxPjQwwtTmrtMw/N9kpUaJIp5lZlcl3VoloxN9QQIdh6JTaa6glp5hcP47Ljnn2yST5zSLWaQarvF3J/Ld1xkhS3HifcJfusqWALa/ywJwNK/tU4BquxcOxnvH1tddhtZdLjT4%2B%2BlsOHGp0Wqs10%2BkAV7i7x09C1pW0aX1k7JUCheF62/T8G%2BvcqPfK5U1w1X5F0Jfdf1plFV4Unin5zULLSdmHwSY88dNrgEvZV0k/m9wZRAlB/gHe3J6xudpetzX69RuxWhd%2BtzHR9fNUwZbOX/LW/2JQ73Ii798nRW5Dqv3FvePgfGnY6ge3o%2B8CfGTHw3%2BRI0D2w%2Bz7Ll6EUCUJucF6XZtJbZdgInmSFJsQqF5ARTytutDuEYCc5IyCJGI6Jku0UjTBDjUYiFJJxE3CWfGrvtsh0UUqoiwpFCTEpgAg2FTCAhOAfJCH4JbA8EigggxiVBYAnhTmw%2BW6kgBRJCQq%2BViEoliZMRXHFGseBCRYIK5jBOMZZSYCWEUkJRp2LN5KHyH1uoKBMYI8qIZEpx7ChEuvRAQlFwUFL4dAjiYKRgRATyl2zkCvfYfTTlTtc%2Bge5czdOXxp0VVbNpwwY9OZK/LPq%2B8/v5SXLn247bFYeRddBoM2uE%2BGOxjnLYqA4Sz4Ucd/xqbXH0yuVDgg4rk0pnmalW31U3mz0ktZvl0CaLojbvPSQ2M/Xr6GzQq81%2BQp2SdA0sl38BYVV2s7sHAAA%3D",
    "link_notebook": "",
    "link_hapi": "",
    "variables_table": "",
    "related_resources": "<ul>\n\t<li><a href=\"https://earth.esa.int/eogateway/activities/amps\">AMPS Project Page</a></li>\n\t<li><a href=\"https://birkeland.uib.no/data/amps/\">WebAMPS</a></li>\n</ul>",
    "details": "<table border=\"1\">\n\t<tbody>\n\t\t<tr>\n\t\t\t<td>Product identifier</td>\n\t\t\t<td>MIO_SHA_2E</td>\n\t\t</tr>\n\t\t<tr>\n\t\t\t<td>Definition</td>\n\t\t\t<td>An empirical model of the Average Magnetic field and Polar current System (<a href=\"https://earth.esa.int/eogateway/activities/amps\">AMPS</a>). See:<br />\n\t\t\t- forward code at <a href=\"https://doi.org/10.5281/zenodo.1182931\">doi: 10.5281/zenodo.1182931</a><br />\n\t\t\t- science paper at <a href=\"https://doi.org/10.1029/2018JA025387\">doi: 10.1029/2018JA025387</a></td>\n\t\t</tr>\n\t\t<tr>\n\t\t\t<td>Input data</td>\n\t\t\t<td>Swarm magnetic field (MAG-L) measurements, CHAMP magnetic field measurements, model predictions of core, lithospheric and large-scale magnetospheric (including Earth-induced) contributions, taken by the CHAOS geomagnetic field model, OMNI solar wind measurements, F10.7 index</td>\n\t\t</tr>\n\t\t<tr>\n\t\t\t<td>Input time span</td>\n\t\t\t<td>Entire Swarm mission + entire CHAMP mission</td>\n\t\t</tr>\n\t\t<tr>\n\t\t\t<td>Spatial representation</td>\n\t\t\t<td>Spherical harmonic expansion in QD/modified apex coordinates, with degree up to 45/65 for poloidal/toroidal magnetic field parts. Spherical harmonic order (in MLT) up to 3</td>\n\t\t</tr>\n\t\t<tr>\n\t\t\t<td>Time representation</td>\n\t\t\t<td>Time dependence contained in parametrization in terms of external parameters: 20 min average solar wind speed and interplanetary magnetic field, dipole tilt angle, and F10.7 index</td>\n\t\t</tr>\n\t\t<tr>\n\t\t\t<td>Units</td>\n\t\t\t<td>Magnetic field in nT, horizontal sheet current density in mA/m, vertical current density in &micro;A/m2</td>\n\t\t</tr>\n\t\t<tr>\n\t\t\t<td>Resolution</td>\n\t\t\t<td>0.1 nT, 1 mA/m, 0.01 &micro;A/m2</td>\n\t\t</tr>\n\t\t<tr>\n\t\t\t<td>Uncertainty</td>\n\t\t\t<td>See <a href=\"https://doi.org/10.1029/2018JA025387\">doi: 10.1029/2018JA025387</a></td>\n\t\t</tr>\n\t\t<tr>\n\t\t\t<td>Quality indicator</td>\n\t\t\t<td>N/A</td>\n\t\t</tr>\n\t\t<tr>\n\t\t\t<td>Data volume</td>\n\t\t\t<td>218 kB</td>\n\t\t</tr>\n\t\t<tr>\n\t\t\t<td>Data format</td>\n\t\t\t<td>ASCII</td>\n\t\t</tr>\n\t\t<tr>\n\t\t\t<td>Output data</td>\n\t\t\t<td>Spherical harmonic coefficient</td>\n\t\t</tr>\n\t\t<tr>\n\t\t\t<td>Output time span</td>\n\t\t\t<td>Model is based on data from entire CHAMP and Swarm missions, but it is in principle valid for any time when solar wind data was available</td>\n\t\t</tr>\n\t\t<tr>\n\t\t\t<td>Update rate</td>\n\t\t\t<td>Yearly (to be confirmed)</td>\n\t\t</tr>\n\t\t<tr>\n\t\t\t<td>Latency</td>\n\t\t\t<td>2 months, due to update rate of OMNI data and computation time</td>\n\t\t</tr>\n\t\t<tr>\n\t\t\t<td>Notes</td>\n\t\t\t<td>&nbsp;</td>\n\t\t</tr>\n\t</tbody>\n</table>\n",
    "changelog": "",
    "fast_processing": "",
    "input_products": [
        "SW_MAGx_LR_1B",
        "SW_MCO_SHA_2X"
    ]
}