{
    "product_id": "SW_PPIxFAC_2F",
    "definition": "Equatorward boundary of SSFACs and the associated midnight PP index",
    "applicable_missions": [
        "Swarm"
    ],
    "applicable_spacecraft": [
        "Swarm-A",
        "Swarm-B",
        "Swarm-C"
    ],
    "thematic_areas": [
        "Ionosphere/Magnetosphere"
    ],
    "description": "Equatorward boundary of SSFACs and the associated midnight PP index",
    "link_files_http": "https://swarm-diss.eo.esa.int/#swarm/Level2daily/Latest_baselines/PPI/FAC",
    "link_files_ftp": "ftp://swarm-diss.eo.esa.int/Level2daily/Latest_baselines/PPI/FAC",
    "link_vires_gui": "",
    "link_notebook": "",
    "link_hapi": "http://hapi-server.org/servers/#server=VirES-for-Swarm&dataset=SW_OPER_PPIAFAC_2F",
    "variables_table": "Variable,Units,Description,Dim,Type\nTimestamp,ms,\"Time of observation, UTC\",1,CDF_EPOCH\nCounter, ,Swarm orbit counter and quarter orbit (four per Swarm orbit) counter that are based on magnetic coordinates as defined in <a href=\"https://earth.esa.int/eogateway/documents/20142/37627/Swarm-PRISM-Description-of-the-algorithm.pdf\">Swarm PRISM processing algorithm description</a> (Sect. 4.1.2.2),2,CDF_UINT4\nLatitude,deg,Position of the SSFAC boundary in ITRF - Geocentric latitude,1,CDF_DOUBLE\nLongitude,deg,Position of the SSFAC boundary in ITRF - Geocentric longitude,1,CDF_DOUBLE\nRadius,m,Position of the SSFAC boundary in ITRF - Geocentric radius (from the Earth center),1,CDF_DOUBLE\nLatitude_QD,deg,QD latitude of the SSFAC boundary,1,CDF_DOUBLE\nLongitude_QD,deg,QD longitude of the SSFAC boundary,1,CDF_DOUBLE\nMLT,h,Magnetic Local Time of SSFAC boundary,1,CDF_DOUBLE\nL_value,R_E,L-value of the SSFAC boundary,1,CDF_DOUBLE\nSZA,deg,Solar zenith angle of the SSFAC boundary,1,CDF_DOUBLE\ndL, ,Boundary width in Earth radii,1,CDF_DOUBLE\nSigma, ,\"Standard deviation of the linear fit of S at the boundary (Heilig, B. and L\u00fchr, H., doi: 10.5194/angeo-31-529-2013\"),1,CDF_DOUBLE\nPPI,R_E,Midnight Plasmapause index,1,CDF_DOUBLE\nQuality, ,Quality indicators of SSFAC boundary detection,7,CDF_INT1\nTimestamp_ID, ,Time vector of observations,2,CDF_EPOCH\nLatitude_ID,deg,Position in ITRF - Geocentric latitude,2,CDF_DOUBLE\nLongitude_ID,deg,Position in ITRF - Geocentric longitude,2,CDF_DOUBLE\nRadius_ID,m,Position in ITRF - Geocentric radius (from the Earth centre),2,CDF_DOUBLE\nLatitude_QD_ID,deg,QD latitude,2,CDF_DOUBLE\nLongitude_QD_ID,deg,QD longitude,2,CDF_DOUBLE\nMLT_ID,h,Magnetic Local Time,2,CDF_DOUBLE\nL_value_ID, ,L-value in Earth radii,2,CDF_DOUBLE\nSZA_ID,deg,L-value in Earth radii,2,CDF_DOUBLE\nPosition_Quality_ID, ,Vector of quality indicators characterising the detection quality of each single positions,2,CDF_INT1\n",
    "related_resources": "<ul>\n<li><a href=\"https://earth.esa.int/eogateway/activities/swarm-prism\">Activity: Plasmapause Related boundaries in the topside Ionosphere as derived from Swarm Measurements (PRISM)</a></li>\n<li><a href=\"https://earth.esa.int/eogateway/documents/20142/37627/Swarm-PRISM-Product-Definition.pdf\">Swarm PRISM product description</a></li>\n<li><a href=\"https://earth.esa.int/eogateway/documents/20142/37627/Swarm-PRISM-Description-of-the-algorithm.pdf\">Swarm PRISM processing algorithm description</a></li>\n<li><a href=\"https://earth.esa.int/eogateway/documents/20142/37627/Swarm-PRISM-Validation-Report.pdf\">Swarm PRISM validation report</a></li>\n</ul>",
    "details": "<table border=\"1\">\n\t<tbody>\n\t\t<tr>\n\t\t\t<td>Product identifier</td>\n\t\t\t<td>PPIxFAC_2F</td>\n\t\t</tr>\n\t\t<tr>\n\t\t\t<td>Definition</td>\n\t\t\t<td>Equatorward boundary of SSFACs and the associated midnight PP index</td>\n\t\t</tr>\n\t\t<tr>\n\t\t\t<td>Input data</td>\n\t\t\t<td>FACxTMS_2F<sup>1</sup>, EFIx_LP_1B<sup>1</sup>, TECxTMS_2F<sup>1</sup>, AOBxFAC_2F<sup>1</sup>, AUXxORBCNT</td>\n\t\t</tr>\n\t\t<tr>\n\t\t\t<td>Input time span</td>\n\t\t\t<td>Up to one year<sup>2</sup></td>\n\t\t</tr>\n\t\t<tr>\n\t\t\t<td>Spatial representation</td>\n\t\t\t<td>One geographic and QD-latitude/longitude pair, the McIlwain L-value as well as radius for each output position at the nearest FAC measurement for each trough crossing, i.e., up to four per orbit</td>\n\t\t</tr>\n\t\t<tr>\n\t\t\t<td>Time representation</td>\n\t\t\t<td>Up to four records per orbit (up to one record per orbit quarter)</td>\n\t\t</tr>\n\t\t<tr>\n\t\t\t<td>Units</td>\n\t\t\t<td>see at Output Data below</td>\n\t\t</tr>\n\t\t<tr>\n\t\t\t<td>Resolution</td>\n\t\t\t<td>0.1 degree for coordinates, 0.01 for L-value</td>\n\t\t</tr>\n\t\t<tr>\n\t\t\t<td>Uncertainty</td>\n\t\t\t<td>~1 degree for coordinates, ~0.1 for L-value</td>\n\t\t</tr>\n\t\t<tr>\n\t\t\t<td>Quality indicator</td>\n\t\t\t<td><strong>Quality</strong> vector flag values are integers ranging from 3 to -1. Positive values indicate good or acceptable observation, while -1 means a likely false observation. For all flags, a 0 value means that the information needed to derive the flag is not available. In general, greater numbers indicate higher quality. A detailed description of the derivation of these flags is given in <a href=\"https://earth.esa.int/eogateway/documents/20142/37627/Swarm-PRISM-Description-of-the-algorithm.pdf\">Swarm PRISM processing algorithm description</a> (see also related resources)</br>\n<strong>Position_Quality_ID</strong> describes the overall quality of the corresponding boundary/position identified by ID. These flags are defined based on the parameter\u2019s sigma and SZA. 3: sig-ma<0.25, 2: 0.25\u2264sigma<0.5, 1: 0.5\u2264sigma AND SZA>90\u00b0, -1: 0.5\u2264sigma AND SZA\u226490\u00b0.\n</td>\n\t\t</tr>\n<tr>\n\t\t\t<td>Data volume</td>\n\t\t\t<td>Up to 1.9 MB</td>\n\t\t</tr>\n\t\t<tr>\n\t\t\t<td>Output data</td>\n\t\t\t<td>See file contents</td>\n\t\t</tr>\n\t\t<tr>\n\t\t\t<td>Output time span</td>\n\t\t\t<td>Up to one year<sup>2</sup></td>\n\t\t</tr>\n\t\t<tr>\n\t\t\t<td>Latency</td>\n\t\t\t<td>< 5 minutes</td>\n\t\t</tr>\n\t\t<tr>\n\t\t\t<td>Update rate</td>\n\t\t\t<td>Daily</td>\n\t\t</tr>\n\t\t<tr>\n\t\t\t<td>Notes</td>\n\t\t\t<td><sup>1</sup> Version information of Input Data are available in the CDF global attributes.</br><sup>2</sup> Product always contains data from the start of the first boundary crossing of the first day until the end of the last boundary-crossing starting the latest day available for that year, i.e., may contain data from the next day if boundary crossing occurs around midnight.</br><sup>3</sup> The meaning of ID: 1 \u2013 Equatorward edge of SSFAC boundary; 2 \u2013 Poleward edge of SSFAC boundary.</br><sup>4</sup> NaN values: if an ID is not identified Timestamp_ID is set to {the value of} Timestamp and corresponding variable values will be set to NaNs.</br></td>\n\t\t</tr>\n\t</tbody>\n</table>",
    "changelog": "",
    "fast_processing": "",
    "input_products": [
        "SW_AOBxFAC_2F",
        "SW_AUXxORBCNT",
        "SW_EFIx_LP_1B",
        "SW_FACxTMS_2F",
        "SW_TECxTMS_2F"
    ]
}