{
    "product_id": "SW_MCO_SHA_2Y",
    "definition": "Model of the core field, related to SW_CFW_SHA_2Y",
    "applicable_missions": [
        "Swarm"
    ],
    "applicable_spacecraft": [
        "Swarm-A",
        "Swarm-B",
        "Swarm-C"
    ],
    "thematic_areas": [
        "Core field"
    ],
    "description": "Series of core field models provided in terms of Gauss coefficients + covariance matrices + standard deviations of Gauss coefficients.\n\nRelated to SW_CFW_SHA_2Y",
    "link_files_http": "https://swarm-diss.eo.esa.int/#swarm/Level2longterm/MCO",
    "link_files_ftp": "ftp://swarm-diss.eo.esa.int/#swarm/Level2longterm/MCO",
    "link_vires_gui": "",
    "link_notebook": "",
    "link_hapi": "",
    "variables_table": "",
    "related_resources": "Ropp, G., Lesur, V., Baerenzung, J., and Holschneider, M. (2020), Sequential modelling of the Earth\u2019s core magnetic field, Earth, Planets and Space, 72(1) :153, doi :10.1186/s40623-020- 01230-1\n\nRopp, G. and Lesur, V. (2022), Mid-latitude and equatorial core surface flow variations derived from observatory and satellite magnetic data, Geophys J. Int., under review",
    "details": "<table border=\"1\">\n\t<thead>\n\t\t<tr>\n\t\t\t<th style=\"text-align: left;\">Product identifier</th>\n\t\t\t<th style=\"text-align: left;\">MCO_SHA_2Y</th>\n\t\t</tr>\n\t</thead>\n\t<tbody>\n\t\t<tr>\n\t\t\t<td>Definition</td>\n\t\t\t<td>&bull; Core field Gauss coefficients stored in the .shc file<br />\n\t\t\t&bull; The standard deviations of Gauss coefficients are stored in the .std file<br />\n\t\t\t&bull; The covariance matrices are stored in the .cov file</td>\n\t\t</tr>\n\t\t<tr>\n\t\t\t<td>Input Data</td>\n\t\t\t<td>Derived from Swarm Level 1b MAGX_LR_1B, the Oersted, Champ, CryoSat data and the Magnetic Observatories data</td>\n\t\t</tr>\n\t\t<tr>\n\t\t\t<td>Input Time Span</td>\n\t\t\t<td>01/01/1999 to latest Swarm data processed</td>\n\t\t</tr>\n\t\t<tr>\n\t\t\t<td>Spatial representation</td>\n\t\t\t<td>Spherical harmonic expansion up to degree and order 18</td>\n\t\t</tr>\n\t\t<tr>\n\t\t\t<td>Time representation</td>\n\t\t\t<td>Snapshots built sequentially through a Kalman filter with a time span of 0.25 &times; 365.25 days</td>\n\t\t</tr>\n\t\t<tr>\n\t\t\t<td>Units</td>\n\t\t\t<td>nT</td>\n\t\t</tr>\n\t\t<tr>\n\t\t\t<td>Resolution</td>\n\t\t\t<td>Temporal resolution: 0.25 &times; 365.25 days<br />\n\t\t\tSpatial resolution: Max SH degree 18</td>\n\t\t</tr>\n\t\t<tr>\n\t\t\t<td>Uncertainty</td>\n\t\t\t<td>See MCO_SHA_2Y cov and std files</td>\n\t\t</tr>\n\t\t<tr>\n\t\t\t<td>Quality indicator</td>\n\t\t\t<td>&nbsp;</td>\n\t\t</tr>\n\t\t<tr>\n\t\t\t<td>Data volume</td>\n\t\t\t<td>~1MB</td>\n\t\t</tr>\n\t\t<tr>\n\t\t\t<td>Data format</td>\n\t\t\t<td>The shc file is in SHC format<br />\n\t\t\tThe std file is in ASCII table format (see description below)<br />\n\t\t\tThe cov file is in ASCII format (see description below)</td>\n\t\t</tr>\n\t\t<tr>\n\t\t\t<td>Output Data</td>\n\t\t\t<td>The product consists in three files<br />\n\t\t\t<br />\n\t\t\t<strong>MCO_SHA_2Y shc and std file</strong><br />\n\t\t\tThe format used has been set in accordance with the usual SHC format defined for this type of files. Units of Gauss coefficients are nT<br />\n\t\t\tWith a very similar format the standard deviations of the Gauss coefficients are provided in an independent file with the extension *.std<br />\n\t\t\tThe only difference in the format is on the first line where the B-spline order, and the number of intervals between spline knots, are not indicated. Units of standard deviations are nT.<br />\n\t\t\t<br />\n\t\t\t<strong>MCO_SHA_2Ycov file</strong><br />\n\t\t\tIn this independent file with the extension *.cov, the covariance matrice upper triangles (i.e. variances and covariances) is provided.<br />\n\t\t\tA covariance matrice being symmetric no information is lost.<br />\n\t\t\tThe format of the file is:<br />\n\t\t\t&bull; On the first line the series of dates (in decimal years) of the mean snapshot core field models associated with the covariance matrices.<br />\n\t\t\t&bull; On the next lines are indicated: the row index of the covariance matrix, the column index of the covariance matrix, followed by the time series of variances or covariances in the order given by the first line dates. Units of matrix elements are nT<sup>2</sup>.</td>\n\t\t</tr>\n\t\t<tr>\n\t\t\t<td>Output time span</td>\n\t\t\t<td>From earliest to latest epoch compatible with input data</td>\n\t\t</tr>\n\t\t<tr>\n\t\t\t<td>Update rate</td>\n\t\t\t<td>Yearly</td>\n\t\t</tr>\n\t\t<tr>\n\t\t\t<td>Latency</td>\n\t\t\t<td>One year</td>\n\t\t</tr>\n\t\t<tr>\n\t\t\t<td>Notes</td>\n\t\t\t<td>&nbsp;</td>\n\t\t</tr>\n\t</tbody>\n</table>\n",
    "changelog": "",
    "fast_processing": "",
    "input_products": [
        "SW_MAGx_LR_1B"
    ]
}