{
    "product_id": "SW_ACCxDISi2_",
    "definition": "-",
    "thematic_areas": [],
    "description": "-",
    "link_files_http": "",
    "link_files_ftp": "",
    "link_vires_gui": "",
    "link_notebook": "",
    "link_hapi": "",
    "variables_table": "",
    "related_resources": "",
    "details": ""
}