{
    "product_id": "SW_AOBxFAC_2F",
    "definition": "Auroral oval boundaries derived from FACs",
    "applicable_missions": [
        "Swarm"
    ],
    "applicable_spacecraft": [
        "Swarm-A",
        "Swarm-B",
        "Swarm-C"
    ],
    "thematic_areas": [
        "Ionosphere/Magnetosphere",
        "Space Weather"
    ],
    "description": "Auroral oval boundaries, associated with auroral precipitation, estimated from the presence of small-scale (<150 km) field-aligned currents.",
    "link_files_http": "https://swarm-diss.eo.esa.int/#swarm/Level2daily/Latest_baselines/AOB/FAC",
    "link_files_ftp": "ftp://swarm-diss.eo.esa.int/Level2daily/Latest_baselines/AOB/FAC",
    "link_vires_gui": "https://vires.services?ws=data%3Aapplication/json%2Bgzip%3Bbase64%2CH4sIAMta5mMC/8Vcb1PqOhP/Kg6vlUnSpn94Bwr3Oo9yvMr1nqPjdApUyXMLZdrCI57xuz%2BblEpDCxSkxHEspMnuL7ubzWaT%2BLsWeeGcDbxHL4xYMKk1zmpaHeM6qp2fwTvfG8TesMP82AtvWBTD%2B%2Bdah79rOd3k0U4el/xxBTXg8dfVjSs%2B3N70%2BKPr8b%2B95C9zxp4bOcOQvYo6vYkzjljEP3Z8982JkwqiucMc7/XV4eXZAkHTYaK1I6g%2BskXy%2BEge76Plcy7wzFyfxQvnNaVzCd/7oRtDj1eFgovTWX1siZ7N%2Bn3fc%2B7CoO/2GSeTqSDe8e/3ng/U5p7z0GtfOve3D7lCXtDsR4E/iwsKHpcFbd%2BbJ7Cak7eE9PW9eNNpXtZe4Bmzsfcg9JKo67lGEKYXmFxouEe0hm43NKtuI%2BuJt4J3xgXC8NtDeoOgBjHqpk2fvkhdBWOXyXSI2cNag%2BoNHdVtQiU6WOsho0FJg5p1jS7pTMNgOBvE0WUweWVvs0SuQPJ37eEf58dd%2B965bf7RdG7uHdwSxXMWMS64xtmr60cekAhmsc8mXpQtmroDLu3GGeY83NAde2CFkaAA1gcC459Cd/LGKT1jihA6P6P8wVENAj8Io4Er%2BNT%2B68W1Ty7GfRtlhgEUxeHM%2B0ysH/QcelFzDcWFwekZWyEs7UxqB40IpflGU9%2BNxm6mXWu/dp%2B8ZaqGduca1HB3PDV0vTVxIiTkScRzI6pimfYKiIFqigkFYey7k6EQzGO0pgN6frZF/n87Qdhncd4Qzs80ulFxOUH2rtsOcY4kSNkrSshMDgwb%2B4sTSAZDzz%2BM5mfGMxc0JTuaSp48Z7DbrUNqz3vwLQJcqiP2NnLewM854Kr6Xo4efvlS7919%2B0ao9/rq9njqTeetfEfynVj4b5P%2BbINS0xkx7scbZbOR5Ody2sx1H%2B2WJ59nDxyd6xwvhNPlfGkx2yHMmeEbm7w5OKXghO7/vklFDiZyYjMI1vWtIuAwDm7cPbhxapntn3e9xIP3LnuIHMkyeeAky5V8efDtMi02UB6BHUYvab34KBztm705xHiL/ZscwGX0rX5BIHp48/YoB7dwopqzkA3BYYs28/3byHFyzk3Ql8/C2Hm9opbxp2K6vG7BdHn74JDOscK/fFCe9%2Bl7hHNSOL9OydBKhlcQwx%2B3m/J6ISdmumdEIK9H1smZuxx5fo2TM7AdFOTlzh79%2BSxYGq03t1FJNcFKqlhNXE4HaIkv0NbWAGA0u0d1p7l/uwLFJp0bAKLQvQsi9rX4mq6%2BPF%2BYFjIJRXXd0HREddM%2BP7swTduyEa1DkU0wMWwqIjvbsA1SR4hapklMoZQhC1cLTiBiUmJRmxKDmjqybRPibSjUTaCoI2LrukU0HTigOrw3YaFoIIqhDItROZsmZCgBKDYG7oZtIUI4FQoNAZWNETDQNIuXGSY2bf5HQwDfFohCCOnihIyJDBPgWEjToBOUJnyRqVs676FBLGxBIakTgnTdQNBZijSseRfYEB7tvfnOouyaGmLnsRfF7nhaS1/fuH0RbE1mvs9NwA/i9eXu8%2B/agldNciTL5fqioPGCpNVevr6tVREWkNbiZS/ZQiLafr5kbTG/%2BF51QvgSfzpyxSdBJhEdJpgaICFTpwhUoNlCkYb0I5RrgjWA/ijoFmPTECqIFuN%2BwDHXBiwcJMkKd8kFC6O8ATDxbOhtAoAFO8F4BYSXgYXaCNsGMi0dNAWWW5JhMHnbzdHU5J/EeuUe6uUY3rtDNou2CBigS10R9rySN%2B%2B2EHquYjn%2Bnc2saVZ8umBiSXwtQwy4pLtp98vydbwwFJw2cDfl/oixbazpVEBaSZxDsEuyz6RQCtkbuKD3a0YlytaMbx/2LWXjKsmvKjM6YL90Mac3PJ5R3sjZyqoS%2BIk%2BSvZlJVa3ph1SjvcPnjbqzsZ9L9zqXwoEIPsWE5dj%2BDCbXHkDCEZWTr1Y4rIRJ241X2QeJHEAcc8n22Y08CbRVhzVDnoA8mcwC1fRX7Es5EEubF/TZGA6L5TNQqN6aRTNDzaexaMdQEzZxBJhyApILENWVGkUT96E7QRhFUi/0A9JFov2GRBXmdhwAwq7QBQmlpUi7ILIhlHWHZXFURRqlCkrhyObVy62iIJhWqasHPvuNluUZa0XeQPhF9ciozUXMQkmgjFfHkG8OQF5r5ZNMpreFjRozShpAkeaIQQcS0JI7IPRPEbK5upsEl3FpJXfWTjatLWPOeQ3I6qbyfbAldunUBTMynsdSia27B5Fhd6znHLgs1hg3KXLW940zeDDm1pa4YpFU99diHSIyNZk%2ByJqKnLH%2Be2GKj3zLhTyflGxH1ob7MmSKV9GZd9UEki6C1TlhFDAu9CO%2BEbObhtKaylaY8q7TSpmruy2W7EA5HjN2DSAbCRLoGQ8s9liDs4bfcP5dEsZTXe70Rw7/dQtYSQVJwPSjeHKF8N3I%2BZEA0WL4K/9v9PGB8XuC7As0287PNiqorKo4mvn86Rr5E1ym5eV23yX3KpdWKe78hWupr/hCgFdSTkudomx2hV5ehihwvDvW2L8KCnGj53Z9mqjyMfIjbvKIkdg3lYRO35xv1QVA7ZH78qiv/ZooSrya48%2BTrZj2J6/nypYa88X6sK09vxD0Y5N611Z7qu1OE1o2vpQFpYOwndVeSvOfKEyshyEH4q2X/IH5RQEicUH8RRswOSPqR3Rm%2B6RzM0fL1PjagsOqp3e7eYP%2B6nwwMVnBit3yOmRPCWOCZg77R3xepXOKT1XWKFL2meHpblTGtV6pw1nhSsM5/fcf5IOHqsI9a%2BiWJGpDreyrnb6/M9UlUV2MDJVpUTSI5nO1AtZMGQDVftj4gxbaSjV5jf4XWZF2Q1%2Bf1pVboNf2laU2QCJZ27PqnB6IPhdCKrNcoD0twM4eq6j5Tx2bp2fp8p3JOx%2BqQvEEwBPqvIeSdJ2s7yr9rApgF8K/WqC4EmVd/3j7sFJ78RsU0S1I11C8etkw11i%2B3SqUX/T/lFK5FUPfgnHL0U%2BQALxpGwV/jB1B94gdLedvNMMfkHMBlYIGTDexajD2Ca6rhuEwK%2BGSLIk1y3d0pBBTY3oVDfKYWDDLcNPRzqG6VwnBGkkyVMSigwDw19CLWKayySprlmGQIh0m%2B55vG7TfwIohmRSw0A2SBr4WXYCiYAyLItiohNsm1i4S9umtg2aQohSGwZLCVAc1av4lzrRLZuwMfv4us3HKw6Hwl5c/2ePDf5d3RPjN7/a77E3ibOXwpLrYwXl4lZZMPhX0H4W24mZ62b5F5Ebez4sjz05j7hE1QrdeZC5EXk5ckOfZS%2B3dh8uM9/%2BnvqBu9rHFHcIIxdWucMfcy/03YXg8vn5f6/XFNWBSAAA",
    "link_notebook": "https://notebooks.vires.services/notebooks/03h3_demo-aebs-aobxfac",
    "link_hapi": "http://hapi-server.org/servers/#server=VirES-for-Swarm&dataset=SW_OPER_AOBAFAC_2F",
    "variables_table": "Variable,Units,Description,Dim,Type\nt, ,\"Time of observation, UTC\",1,CDF_EPOCH\nLatitude,deg,Position in ITRF - Geocentric latitude,1,CDF_DOUBLE\nLongitude,deg,Position in ITRF - Geocentric longitude,1,CDF_DOUBLE\nRadius,m,Position in ITRF - Geocentric radius (from the Earth center),1,CDF_DOUBLE\nLatitude_QD,deg,Quasi-dipole latitude,1,CDF_DOUBLE\nLongitude_QD,deg,Quasi-dipole longitude,1,CDF_DOUBLE\nMLT,hour,Magnetic Local Time (QD),1,CDF_DOUBLE\nBoundary_Flag,,Indicator for equatorward (=1) or poleward (=2) boundary,1,CDF_UINT1\nQuality,,\"Quality indicator of equatorward/poleward boundary (Pa, Sigma)\",2,CDF_DOUBLE\nPair_Indicator,,\"Indicator of equatorward/poleward boundary of auroral oval. If the auroral oval boundaries are detectable as one pair, the pair indicator represents the record of previous (-1) or next (1) equatorward/poleward boundary within one pair; otherwise, the pair indicator is set to 0\",1,CDF_INT1\n",
    "related_resources": "<ul>\n<li><a href=\"https://earth.esa.int/eogateway/activities/swarm-aebs\">Activity: Auroral Electrojet and auroral Boundaries estimated from Swarm observations</a></li>\n<li><a href=\"https://earth.esa.int/eogateway/documents/20142/37627/Swarm-AEBS-product-definition.pdf\">Swarm-AEBS Product Definition</a></li>\n<li><a href=\"https://earth.esa.int/eogateway/documents/20142/37627/Swarm-AEBS-processing-algorithm-description.pdf\">Swarm-AEBS Description of the Processing Algorithm</a></li>\n<li><a href=\"https://earth.esa.int/eogateway/documents/20142/37627/Validation-auroral-electrojet-auroral-boundaries-estimated-from-swarm.pdf\">Validation of Auroral Electrojet and Auroral Boundaries estimated from Swarm observations</a></li>\n</ul>\n",
    "details": "<table border=\"1\">\n<tbody>\n  <tr>\n    <td> Product identifier  </td>\n    <td> AOBxFAC_2F  </td>\n  </tr>\n  <tr>\n    <td> Definition  </td>\n    <td> Auroral Oval Boundaries using the FAC method  </td>\n  </tr>\n  <tr>\n    <td> Input Data  </td>\n    <td> FACxTMS_2F<sup>1</sup>  </td>\n  </tr>\n  <tr>\n    <td> Input Time Span  </td>\n    <td> Up to one year  </td>\n  </tr>\n  <tr>\n    <td> Spatial representation  </td>\n    <td> One geographic and quasi-dipole latitude/longitude as well as magnetic local time for each output value at the nearest magnetic-field measurement.  </td>\n  </tr>\n  <tr>\n    <td> Time representation  </td>\n    <td> One timestamp for each boundary represented by the geographic and quasi-dipole latitude/longitude as well as magnetic local time.  </td>\n  </tr>\n  <tr>\n    <td> Units  </td>\n    <td> Degrees  </td>\n  </tr>\n  <tr>\n    <td> Resolution  </td>\n    <td> Full resolution (Double precision)  </td>\n  </tr>\n  <tr>\n    <td> Uncertainty  </td>\n    <td> 3 deg, c.f. Xiong, C. and L\u00fchr, H., doi: 10.5194/angeo-32-623-2014  </td>\n  </tr>\n<tr>\n    <td> Quality indicator </td>\n    <td>\n<table border=\"1\">\n<tbody>\n  <tr>\n    <td>Value</td>\n    <td>Meaning</td>\n  </tr>\n  <tr>\n    <td>Pa</td>\n    <td>Slop of linear fit of S value. Users are suggested to use boundaries with pa larger than 0.2</td>\n  </tr>\n  <tr>\n    <td>Sigma</td>\n    <td>The standard deviation of the linear fit of S value. Users are suggested to use boundaries with \u03c3 less than 0.4. See SW-DS-GFZ-GS-001_AEBS_DPA Swarm-AEBS Description of the Processing Algorithm, for the S value definition</td>\n  </tr>\n</tbody>\n</table>\n</td>\n  </tr>\n  <tr>\n    <td> Data volume  </td>\n    <td> Up to 2.5 MB  </td>\n  </tr>\n  <tr>\n    <td> Data format  </td>\n    <td> CDF  </td>\n  </tr>\n  <tr>\n    <td> Output time span  </td>\n    <td> Up to one year<sup>2</sup>  </td>\n  </tr>\n  <tr>\n    <td> Update rate  </td>\n    <td> Daily  </td>\n  </tr>\n  <tr>\n    <td> Latency  </td>\n    <td> &lt; 1 day  </td>\n  </tr>\n  <tr>\n    <td> Notes  </td>\n    <td> <sup>1</sup> Version information of Input Data are available in the CDF global attributes. <br> <sup>2</sup> Product always contain data from the start of the first oval crossing of the year until the end of the last oval crossing starting that year, i.e., may contain data from the next year if oval crossing occurs around midnight.  </td>\n  </tr>\n</tbody>\n</table>",
    "changelog": "",
    "fast_processing": "",
    "input_products": [
        "SW_FACxTMS_2F"
    ]
}