{
    "product_id": "SW_EGF_SHA_2_",
    "definition": "Monthly gravity field of the Earth",
    "applicable_missions": [
        "Swarm"
    ],
    "applicable_spacecraft": [
        "Swarm-A",
        "Swarm-B",
        "Swarm-C"
    ],
    "thematic_areas": [
        "Geodesy/Gravity"
    ],
    "description": "Monthly average of Earth's gravity field, i.e. with an implicit epoch located at the middle of the calendar month",
    "link_files_http": "https://swarm-diss.eo.esa.int/#swarm/Level2longterm/EGF",
    "link_files_ftp": "ftp://swarm-diss.eo.esa.int/Level2longterm/EGF",
    "link_vires_gui": "",
    "link_notebook": "",
    "link_hapi": "",
    "variables_table": "",
    "related_resources": "",
    "details": "<table border=\"1\">\n\t<tbody>\n\t\t<tr>\n\t\t\t<td>Product identifier</td>\n\t\t\t<td>EGF_SHA_2_</td>\n\t\t</tr>\n\t\t<tr>\n\t\t\t<td>Definition</td>\n\t\t\t<td>Monthly gravity field of the Earth</td>\n\t\t</tr>\n\t\t<tr>\n\t\t\t<td>Input data</td>\n\t\t\t<td>GPSA_RO_1B, GPSB_RO_1B, GPSC_RO_1B, STRAATT_1B, STRBATT_1B, STRCATT_1B</td>\n\t\t</tr>\n\t\t<tr>\n\t\t\t<td>Input time span</td>\n\t\t\t<td>1 calendar month</td>\n\t\t</tr>\n\t\t<tr>\n\t\t\t<td>Spatial representation</td>\n\t\t\t<td>Spherical harmonic coefficients</td>\n\t\t</tr>\n\t\t<tr>\n\t\t\t<td>Time representation</td>\n\t\t\t<td>Monthly average of Earth&#39;s gravity field, i.e. with an implicit epoch located at the middle of the calendar month</td>\n\t\t</tr>\n\t\t<tr>\n\t\t\t<td>Units</td>\n\t\t\t<td>See output data</td>\n\t\t</tr>\n\t\t<tr>\n\t\t\t<td>Resolution</td>\n\t\t\t<td>12 significant digits in scientific notation</td>\n\t\t</tr>\n\t\t<tr>\n\t\t\t<td>Uncertainty</td>\n\t\t\t<td>Typically 1-2 mm geoid height or 1-2 cm Equivalent Water Height discrepancy w.r.t. GRACE over land areas during low solar activity periods, considering Gaussian smoothing with 750km spherical cap radius</td>\n\t\t</tr>\n\t\t<tr>\n\t\t\t<td>Quality indicator</td>\n\t\t\t<td>RMS over ocean areas that are 6 degrees away from coast lines, after removing long-term trend, annual and semi-annual variations estimated from monthly un-weighted averages of numerous GRACE models (AIUB02, CSR05, GRGS03, ITSG14, GFZ05a, JPL05 and TNJ01)</td>\n\t\t</tr>\n\t\t<tr>\n\t\t\t<td>Data volume</td>\n\t\t\t<td>20 Kb</td>\n\t\t</tr>\n\t\t<tr>\n\t\t\t<td>Data format</td>\n\t\t\t<td>ASCII file with Stokes Coefficients following the ICGEM-format (http://icgem.gfz-potsdam.de/ICGEM-Format-2011.pdf)</td>\n\t\t</tr>\n\t\t<tr>\n\t\t\t<td>Output data</td>\n\t\t\t<td>Degree, order, cosine coefficient, sine coefficient (columns 5 and 6 set to zero)</td>\n\t\t</tr>\n\t\t<tr>\n\t\t\t<td>Output time span</td>\n\t\t\t<td>1 calendar month</td>\n\t\t</tr>\n\t\t<tr>\n\t\t\t<td>Update rate</td>\n\t\t\t<td>Quarterly</td>\n\t\t</tr>\n\t\t<tr>\n\t\t\t<td>Latency</td>\n\t\t\t<td>5 months</td>\n\t\t</tr>\n\t\t<tr>\n\t\t\t<td>Notes</td>\n\t\t\t<td>- Stokes coefficients available up to degree 40<br />\n\t\t\t&nbsp;- No smoothing applied<br />\n\t\t\t&nbsp;- GRACE comparison indicates that there is little useful geophysical signal above roughly degree 12, i.e. it suggest the signal-to-noise ratio drops below 1 at those degrees and above<br />\n\t\t\t&nbsp;- Further product details in Swarm ITT1.1 TN-01</td>\n\t\t</tr>\n\t</tbody>\n</table>\n",
    "changelog": "",
    "fast_processing": "",
    "input_products": [
        "SW_GPSx_RO_1B",
        "SW_STRxATT_1B"
    ]
}