{
    "product_id": "SW_EFIxLPI_1B",
    "definition": "Electric field instrument (Langmuir probe measurements at 1Hz)",
    "applicable_missions": [
        "Swarm"
    ],
    "applicable_spacecraft": [
        "Swarm-A",
        "Swarm-B",
        "Swarm-C"
    ],
    "thematic_areas": [
        "Plasma measurements",
        "Space Weather"
    ],
    "description": "The EFIX_LP_1B Product contains plasma data from the Langimur Probe (LP) of the Electrical Field Instrument (EFI). The plasma product encompasses the plasma density and temperature. Data is provided at 2 Hz rate. The time instant are determined by the EFI instruments. No interpolation of the EFI data is performed, neither to shift the measurements in time nor to fill any gaps.",
    "link_files_http": "https://swarm-diss.eo.esa.int/#swarm/Level1b/Latest_baselines/EFIxLPI",
    "link_files_ftp": "ftp://swarm-diss.eo.esa.int/Level1b/Latest_baselines/EFIxLPI",
    "link_vires_gui": "",
    "link_notebook": "",
    "link_hapi": "",
    "variables_table": "Variable,Units,Description,Dim,Type\nTimestamp,-,Time stamp,1,CDF_EPOCH\nSyncStatus,-,Synchronization status,1,CDF_UINT2\nLatitude,deg,Geocentric latitude,1,CDF_DOUBLE\nLongitude,deg,Geocentric longitude,1,CDF_DOUBLE\nRadius,m,Distance from the Earth\u2019s center,1,CDF_DOUBLE\nU_orbit,m/s,Spacecraft velocity in the ITRF,1,CDF_DOUBLE\nNe,cm-3,Plasma density (electron),1,CDF_DOUBLE\nNe_error,cm-3,Error estimate of plasma density (ne),1,CDF_DOUBLE\nTe,K,Plasma electron temperature,1,CDF_DOUBLE\nTe_error,K,Error estimate of plasma electron temperature (T_elec),1,CDF_DOUBLE\nVs,V,Spacecraft potential,1,CDF_DOUBLE\nVs_error,V,Error estimate of spacecraft potential (U_pol),1,CDF_DOUBLE\nFlags_LP,-,\"Flags indicating the source/method of LP measurements (Ne, Te, Vs)\",1,CDF_UINT1\nFlags_Ne,-,Flags characterizing the plasma density measurement,1,CDF_UINT1\nFlags_Te,-,Flags characterizing the electron temperature measurement,1,CDF_UINT1\nFlags_Vs,-,Flags characterizing the spacecraft potential measurement,1,CDF_UINT1\n",
    "related_resources": "",
    "details": "",
    "changelog": "",
    "fast_processing": ""
}