{
    "product_id": "SW_MIO_SHA_2C",
    "definition": "Model of non-polar daily geomagnetic variation caused by ionospheric currents, derived in comprehensive chain (CI)",
    "applicable_missions": [
        "Swarm"
    ],
    "applicable_spacecraft": [
        "Swarm-A",
        "Swarm-B",
        "Swarm-C"
    ],
    "thematic_areas": [
        "Ionosphere/Magnetosphere"
    ],
    "description": "Model of non-polar daily geomagnetic variation caused by ionospheric currents, including their variability with season and solar flux, derived in Comprehensive Inversion chain",
    "link_files_http": "https://swarm-diss.eo.esa.int/#swarm/Level2longterm/MIO",
    "link_files_ftp": "ftp://swarm-diss.eo.esa.int/Level2longterm/MIO",
    "link_vires_gui": "https://vires.services?ws=data%3Aapplication/json%2Bgzip%3Bbase64%2CH4sIAMta5mMC/51Va0/bMBT9K1W%2Bro38iF98K4UOJB4TZQOKqig0pngySZWkHQj1v%2B/a9JGGwaCS1cbH95xzc%2B1cvwSlLuZmrH/pojR5Fuy1AhpiHKKg3Qoq86gH2upx9bp0GxCEeQdhGJcI7fkRIoSGLrq2RugeUzBCpdQwGC2lDvLHxKx1WAeTDoVY8p4OuURba05nbvSfekrBxOZ32tGmRZ7OxlXZy7N7M5kVyTLiJRhcxec/Di/i0%2B73bnxyEeN9D89Nae6shuf7xJYaJPJZZU2myzo0TcamegYEO4%2BkSB51BbXyCvvx2WHPPxVJNnFKt5hBqu0Wc38u33Fu86IcJ94n%2BK2rYAFo/6skAEv/1joFqCpm2sl4/7jQZbeRRYc7Pf5RCmtufJqn2m7zgSzYe%2BSFo29ImzK6tLZKhkLxtmj9XQp29CY/8qVKXTdMkTcl9EPTm0ZRhSeJf3JSM9fFxGSTGHvusMEl3u8zzOMGUwJRfoJ3sCOvb7RNV8e%2BXqN2K0If1uc6PrxqmDLYyf9b3uxKHO5EXPjlx2me6axyb3n7Ehh3OoLT4/N4cNSNSc%2BfGzPxLeVb0Dy12czaxehVCNAi%2BZGXZt1fppsJHGeGJMUqFJITTClvtzqEYyQ4IyGLGI2Iku0WjTBBjEchFpJwEnH3CqkpNq22g0JKVUQ4UohJCUygoZAJJATnIBnBL4FNgkARAcS4JAgsIdyJzaZLFaRAQkhouBJRqSRxMoIrzigWXKhIUMEcxinGUgqshFBKKOpUCjN5qPwXFyrKBMaIMiKZUhw7CpEuPZBQFByUFD4dgjgYKRgRgfwlG7nCPXWfTLnVuk%2BgRVez9LV727xqdm7YpmdH8jdG37d/Pz9J7nzvcbviMLIKGq1njRB/OFZRDhvVQeK5kOOWX603jt64fErQYWVSaWtNtfy6unb6kNSul/0imee1ee8hKayp30lng15t9hPqlKQrYLH4C9N3F07ABwAA",
    "link_notebook": "",
    "link_hapi": "",
    "variables_table": "",
    "related_resources": "Part of the CI (comprehensive inversion) chain, related to the \"CM\" model series, see e.g.:\n\nSabaka, T.J., T\u00f8ffner-Clausen, L., Olsen, N. et al. CM6: a comprehensive geomagnetic field model derived from both CHAMP and Swarm satellite observations. Earth Planets Space 72, 80 (2020). https://doi.org/10.1186/s40623-020-01210-5",
    "details": "<table border=\"1\">\n\t<thead>\n\t\t<tr>\n\t\t\t<th>Product identifier</th>\n\t\t\t<th>MIO_SHA_2C</th>\n\t\t</tr>\n\t</thead>\n\t<tbody>\n\t\t<tr>\n\t\t\t<td>Definition</td>\n\t\t\t<td>Spherical harmonic representation of the daily geomagnetic variations at mid and low<br />\n\t\t\tlatitudes (Sq and EEJ) and of its induced counterpart</td>\n\t\t</tr>\n\t\t<tr>\n\t\t\t<td>Input Data</td>\n\t\t\t<td>MAGx_LR_1R, AUX_DST_2_, AUX_KP__2_, AUX_F10_2_, Q3D_CI_i2_</td>\n\t\t</tr>\n\t\t<tr>\n\t\t\t<td>Input time span</td>\n\t\t\t<td>All available quiet time observations from the mission</td>\n\t\t</tr>\n\t\t<tr>\n\t\t\t<td>Spatial representation</td>\n\t\t\t<td>Spherical Harmonics up to degree 60 and order 12 in dipole coordinates</td>\n\t\t</tr>\n\t\t<tr>\n\t\t\t<td>Time representation</td>\n\t\t\t<td>Fourier Series, seasonal and daily periodicity</td>\n\t\t</tr>\n\t\t<tr>\n\t\t\t<td>Units</td>\n\t\t\t<td>nT</td>\n\t\t</tr>\n\t\t<tr>\n\t\t\t<td>Resolution</td>\n\t\t\t<td>1 pT</td>\n\t\t</tr>\n\t\t<tr>\n\t\t\t<td>Uncertainty</td>\n\t\t\t<td>Refer to product quality report</td>\n\t\t</tr>\n\t\t<tr>\n\t\t\t<td>Quality indicator</td>\n\t\t\t<td>Statistics of data misfit provided in the validation report</td>\n\t\t</tr>\n\t\t<tr>\n\t\t\t<td>Data volume</td>\n\t\t\t<td>~130 kB</td>\n\t\t</tr>\n\t\t<tr>\n\t\t\t<td>Data format</td>\n\t\t\t<td>ASCII listing</td>\n\t\t</tr>\n\t\t<tr>\n\t\t\t<td>Output data</td>\n\t\t\t<td>Coefficients of SH model in dipole coordinates, with seasonal and diurnal periodicity</td>\n\t\t</tr>\n\t\t<tr>\n\t\t\t<td>Output time span</td>\n\t\t\t<td>N/A</td>\n\t\t</tr>\n\t\t<tr>\n\t\t\t<td>Update rate</td>\n\t\t\t<td>First after 1 year, updated every year</td>\n\t\t</tr>\n\t\t<tr>\n\t\t\t<td>Latency</td>\n\t\t\t<td>1.5 months</td>\n\t\t</tr>\n\t\t<tr>\n\t\t\t<td>Notes</td>\n\t\t\t<td>&nbsp;</td>\n\t\t</tr>\n\t</tbody>\n</table>",
    "changelog": "",
    "fast_processing": "",
    "input_products": [
        "SW_MAGx_LR_1B"
    ]
}