{
    "product_id": "SW_EFIx_TCT16",
    "definition": "Swarm Electric Field Instrument (EFI) Thermal Ion Imager (TII) 16Hz Cross-Track ion flow velocity dataset",
    "applicable_missions": [
        "Swarm"
    ],
    "applicable_spacecraft": [
        "Swarm-A",
        "Swarm-B",
        "Swarm-C"
    ],
    "thematic_areas": [
        "Plasma measurements",
        "Space Weather"
    ],
    "description": "Swarm Electric Field Instrument (EFI) Thermal Ion Imager (TII) dataset at 16 Hz cadence containing cross-track ion measurements: the TII L1B data processing is simplified by deriving ion flow velocity components perpendicular to the satellite velocity vector. The data also include the electric field, magnetic field in the same coordinate frame.\n",
    "link_files_http": "https://swarm-diss.eo.esa.int/#swarm/Advanced/Plasma_Data/16Hz_TII_Cross-track_Dataset/",
    "link_files_ftp": "ftp://swarm-diss.eo.esa.int/Advanced/Plasma_Data/16Hz_TII_Cross-track_Dataset/",
    "link_vires_gui": "https://vires.services?ws=data%3Aapplication/json%2Bgzip%3Bbase64%2CH4sIAMta5mMC/8Vbb3OyuhL/Kh1ft04S8of0XbX2nGdu69Pbenqf006HQaSaexAcQG/1mX73mwRREFS0tXScAiHZ/WV3s9lswu9G5IYz4bhPbhiJwG9cnjWMJoRN0Dg/k%2B8814ndwY3wYje8FVEs3780btS7ltVNLp3k0laXa1lDXv59fWvrm7vbnrp0XfW/l/wX1ti1I2sQijddp%2Bdb40hE6vbGs4dWnFTQzS1huW9vlirPFmialtCtLU31ScyTyyK5vI%2BW15nGM7U9Ec%2Btt5ROWz73QzuWPV4WvsrSWIzdR93lRBIvDQQgvQBQ/nqQXUJ0CXGTUfasaKzeoR4wLjG6BGYTU/68InUdjG2xokMuILowQA8CWfHSMJuQGZt0IL4E9BLzJgU4oTMJg8HUiaN24L%2BJ4TSBLEn%2Bbjz%2Bx/p533mw7q7%2BuLJuHyzY0sUzEYm%2B58r7N9uLXEkimMae8N0oWzSxHSkPWQIVDzu0x65UcKQpSMV22voutP2hovQCCQDg/Iyoi0LlBF4QRo6t%2BTT%2B68aND6W9QxtlLEwWxeHU/UgMq9O2Qje62kBxQRU9uhOC0qW1AUQ2QoQUG008OxrbmXatw9p9qJapGjo3P6Qa7r9ODV13Q5wAaHkifd2KqlymvRJiUjXlhIIw9mx/oAXzFG3ogJyf7ZD/X1YQ9kVcNITzM4NsVVxBkL0fHQtZXyTIvMPJIWMKGKSHi1OSDAaudxzNj4zTK2mK9jTNOcmCwe62jlx71YNPEVBSHYnhyBpKP2dJV9V3C/Tg60q99w%2BdW63eH9d3X6fedEoodqTYibk39PvTLUpNJ5u4H2%2BVzVaSH8sZqdB9sF%2Beago7cnRucrzQTlfxJeVsB2LmhkPhDy2YUrBC%2B3%2BfpJKfpwtiowhivFMECsbRjbtHN04ts/Prvpd48F67B9CGZSoDOcIwVUiSFytaOfDdIi23TxXbHEcvaT1flA727c5cRk/zw5scwWX0qX7JEO/45p1RAW7pPDUToRhIf63bzA5vk49AC16CvH6URqWbFQ3tTlVdR5paaN8HkVhFhJP1wwuGiEHKm8wAmDLKpX1eyBvTRKDJOCWGCbjiCw2TY9LkhGCCOdRjZSDCdQh8AZqIAMQ4AZQgYnBIZQTQRKbBDERNRilhGFIm6YMmR0Q%2BQ2QySZYnI286WZKhEBkGNw2KAKcQI0WGcgxNBjkgDDITcVVmMNPAhkkA48zkJlNEQjnL6LWHRI85NyQhxGQDU4OhVHXEwIRIdMCQfTWbEhxlEiCmpkkZdi8g0zJ%2Bv3oXUTbIl5P52I1iezxppK9v7b72/v7U89S49oJ4M/5%2B%2Bd2Yq6o6ulcjXaGclzSeo7Ta6%2Bppo4q2mrSWKnvNFiLdVkLPc1xU5FiJ%2BGvWexWXGmsJqacrbzKy9Z0mk2gFIkioSRHDBHATGFqTmOb%2BmCpjgEgjNAiSmoeM6vA6mo/7gepBwxGh4%2BkFnb3kArW1y%2BWkiKcDdxsAqNlpxmsgqgxIqwaQU8BMbECDoaoMA3%2B4nyMz8n8axUYPcTWGD/ZATKMdApbQc13Rhr%2BWt%2Bq2FnqhYjX%2BN9tZk6z4sGZi5vgmo5Ak3U27X5Wv5Yah5rSFO8v3Z%2Bk28jrVkNYSVxB4RfaZBWMpewpLer9hVLpsw/gOYd%2BqbVwliZrajE6yX7qY7zc8lZraytnMqlLy033M2ZeZWN2GdlA13j/VIrk7HffdcKd/KRFA3rcwWI3h49S/dh0Zvq6dernE80acuNViETtK4hLEg5rHryLH9aOdOE476CWQP4NpeOUPPXeHLPKDXNu%2BYeSBYR0L8bw4cGUUVwsxnsajPUBY3sQSYeQVkFhGXlGVUTy7vtgLwiyRfqkfylksOGRAXGfizi0oeIkoGMwrRdsFyhtGVXdUFUdZqFGlrBqObBat3CJKhmmVsmrsu7tsMS9rXOYNtF/ciIw2XIQf%2BJqxWlDLeNOX8l4vtPNoejvQgA2jJAmc3Ayh4Zg5hIgfjeYpqm2uzqYM65i0innUL5u2DjGHYur1dDPZAbgKWdmagtl8ZreWiS2bkT2h96ymHHmvFxj36fJWNU3zlfJNI61wLaKJZ891yk3n97J90TVrcsfF5OopPfM%2BFPnseLkf2hjsyZKpWEbyvqkikDTnfcoJoYR3qR2ptPV%2BG0pr1bTGzOfW65i5spsM5QLIx2t02wDiIC%2BBivHMdos5Om/0CefTrWQ03d1G89Xpp24FIzlxMiDdBjv5Yvh%2BJKzIqWkRvNru%2BN74oNx9SSzL9NseD7auWFtUsdro%2BdY18ja5zarKbbZPbqddWKebkCdcTX/CFUp0FeU43yfG067I073XE4Z/nxLjoqIYF3uz7aeNIp8iO%2B7WFjlK5p06YscV93ZdMWBn9F5b9NcZzeuK/DqjxbftGHZm798VrHVm8/rCtM5sUdOOTeu9ttxXa/49oWlrUVtY6oTvdeWtFPN5nZGlEy5q2n4pnguqIUgsP3dUwwbMdRTXpIfBTtanFf%2B/JnXJ%2BwYCVldInR7psSZuKIKBcOrKr%2BozEJWhnDY%2BVh/V1BQdqw956oqN1ddDNUXGUuKZb03qiI%2Bl4PchOG2ULKW/G8CXx8ot6%2Bnmzvr1XfFywu7v%2BmLmBMBzXXFzsujfLu9Te9gUwN81%2BtUEwXNd3vVxYjuuE9q7tqwN2XVEuKQKAJUd1ewg5AhjTBGSPwMkR6QJNrFpAEqYgTDBtBoGMdjhYTDAUPoxjBAwUBLgIwIoher0NzERY8vVBTZMqhECzMmB%2B9LbPhgqh8QIpYBLM5P8TJ5AQlLupkkgwghyBrWdcE44l0oBgBAutVUBlEL1pj9qje6EL8ZisfrUQlUcDPRBetv71RPOP%2BvT2%2BrIdOc9dv04PU19fpaeqU6OXW99qw9qB84/ms/L8gMSfcmcC9/6PrJj15MLBTcfmi/xtkJ7FmQ%2BS2mP7NAT2Y%2Bquo/tzNNfEy%2Bw16lBfeQ/svueO/g5c0PPnmsuHx//B2g3SD8dPAAA",
    "link_notebook": "https://notebooks.vires.services/notebooks/03k2_demo-efixtct",
    "link_hapi": "http://hapi-server.org/servers/#server=VirES-for-Swarm&dataset=SW_EXPT_EFIA_TCT16",
    "variables_table": "Variable,Units,Description,Dim,Type\nTimestamp,UTC,Time of observation.,1,CDF_EPOCH\nLatitude,degrees,Geocentric latitude.,1,CDF_REAL4\nLongitude,degrees,Geocentric longitude.,1,CDF_REAL4\nRadius,m,Geocentric radius.,1,CDF_REAL4\nQDLatitude,degrees,Quasi-dipole magnetic latitude.,1,CDF_REAL4\nMLT,hour,Magnetic local time.,1,CDF_REAL4\nVixh,m/s,Along-track ion drift from horizontal TII sensor in satellite-track coordinates.,1,CDF_REAL4\nVixh_error,m/s,Random error estimate for along-track ion drift from horizontal TII sensor in satellite-track coordinates. Negative value indicates no estimate available.,1,CDF_REAL4\nVixv,m/s,Along-track ion drift from vertical TII sensor in satellite-track coordinates.,1,CDF_REAL4\nVixv_error,m/s,Random error estimate for along-track ion drift from vertical TII sensor in satellite-track coordinates. Negative value indicates no estimate available.,1,CDF_REAL4\nViy,m/s,Cross-track horizontal ion drift from horizontal TII sensor in satellite-track coordinates.,1,CDF_REAL4\nViy_error,m/s,Random error estimate for cross-track horizontal ion drift from horizontal TII sensor in satellite-track coordinates. Negative value indicates no estimate available.,1,CDF_REAL4\nViz,m/s,Cross-track vertical ion drift from vertical TII sensor in satellite-track coordinates.,1,CDF_REAL4\nViz_error,m/s,Random error estimate for cross-track vertical ion drift from vertical TII sensor in satellite-track coordinates. Negative value indicates no estimate available.,1,CDF_REAL4\nVsatN,m/s,Satellite velocity N component in north-east-centre coordinates.,1,CDF_REAL4\nVsatE,m/s,Satellite velocity E component in north-east-centre coordinates.,1,CDF_REAL4\nVsatC,m/s,Satellite velocity C component in north-east-centre coordinates.,1,CDF_REAL4\nEhx,mV/m,\"Electric field x component in satellite-track coordinates, derived from -VxB with along-track ion drift from horizontal sensor.\",1,CDF_REAL4\nEhy,mV/m,\"Electric field y component in satellite-track coordinates, derived from -VxB with along-track ion drift from horizontal sensor.\",1,CDF_REAL4\nEhz,mV/m,\"Electric field z component in satellite-track coordinates, derived from -VxB with along-track ion drift from horizontal sensor.\",1,CDF_REAL4\nEvx,mV/m,\"Electric field x component in satellite-track coordinates, derived from -VxB with along-track ion drift from vertical sensor.\",1,CDF_REAL4\nEvy,mV/m,\"Electric field y component in satellite-track coordinates, derived from -VxB with along-track ion drift from vertical sensor.\",1,CDF_REAL4\nEvz,mV/m,\"Electric field z component in satellite-track coordinates, derived from -VxB with along-track ion drift from vertical sensor.\",1,CDF_REAL4\nBx,nT,\"Geomagnetic field x component in satellite-track coordinates, derived from the 1 Hz product.\",1,CDF_REAL4\nBy,nT,\"Geomagnetic field y component in satellite-track coordinates, derived from the 1 Hz product.\",1,CDF_REAL4\nBz,nT,\"Geomagnetic field z component in satellite-track coordinates, derived from the 1 Hz product.\",1,CDF_REAL4\nVicrx,m/s,Ion drift corotation signal x component in satellite-track coorinates. This has been removed from ion drift and electric field.,1,CDF_REAL4\nVicry,m/s,Ion drift corotation signal y component in satellite-track coorinates. This has been removed from ion drift and electric field.,1,CDF_REAL4\nVicrz,m/s,Ion drift corotation signal z component in satellite-track coorinates. This has been removed from ion drift and electric field.,1,CDF_REAL4\nQuality_flags,-,\"Bitwise flag for each velocity component, where a value of 1 for a particular component signifies that calibration was successful, and that the baseline 1-sigma noise level is less than or equal to 100 m/s at 2 Hz. Electric field quality can be assessed from these flags according to -vxB. Bit0 (least significant) = Vixh, bit1 = Vixv, bit2 = Viy, bit3 = Viz. Refer to the release notes for details.\",1,CDF_UINT2\nCalibration_flags,-,Information about the calibration process. Refer to the release notes for details.,1,CDF_UINT4",
    "related_resources": "<p><strong>Product Descriptions:</strong></p>\n\n<ul>\n\t<li><a href=\"https://earth.esa.int/eogateway/documents/20142/37627/swarm-EFI-TII-cross-track-flow-dataset-release-notes.pdf/153449df-b25c-b98e-0052-1e6d25254ff8?version=1.3&t=1610383268866\">Product Release Note</a></li>\n\n</ul>\n",
    "details": "",
    "changelog": "",
    "fast_processing": ""
}